{"$schema":"https://json-schema.org/draft/2020-12/schema","$id":"https://ai-vlog.local/contracts/worker/render-timeline-request.v1.json","title":"RenderTimelineRequestV1","type":"object","additionalProperties":false,"required":["task_type","graph","execution_plan","output_dir"],"properties":{"task_type":{"const":"render.timeline.v1"},"graph":{"$ref":"https://ai-vlog.local/contracts/render/render-graph-execution.v1.json"},"execution_plan":{"$ref":"https://ai-vlog.local/contracts/render/render-execution-plan.v2.json"},"output_dir":{"type":"string","minLength":1}}}

