{"task_type":"render.timeline.v1","graph":{"schema_version":1,"graph_id":"master-timeline-v1","timeline_version":1,"target":"master","nodes":[{"node_id":"source","kind":"source","capability":"source.original"}],"edges":[],"source_refs":[],"profile":{"name":"master"}},"execution_plan":{"schema_version":2,"plan_id":"plan-master-aaaaaaaaaaaaaaaaaaaaaaaa","target":"master","semantic_graph_payload":"{}","semantic_graph_hash":"aaaaaaaaaaaaaaaaaaaaaaaaaaaaaaaaaaaaaaaaaaaaaaaaaaaaaaaaaaaaaaaa","adapter_id":"worker-media","adapter_version":"v7","capability_snapshot":{"schema_version":1,"adapter_id":"worker-media","adapter_version":"v7","capabilities":["source.original"]},"decisions":[{"schema_version":1,"node_id":"source","capability":"source.original","outcome":"execute"}],"cache_key_payload":"{}","cache_key":"bbbbbbbbbbbbbbbbbbbbbbbbbbbbbbbbbbbbbbbbbbbbbbbbbbbbbbbbbbbbbbbb","diagnostics":[]},"output_dir":"renders"}

